Day,Title,How to apply (optional),URL of where to,Company,Full Job Description,Location,Country,Tags Matched,Notes,Within_3_Days
2025-09-21,Senior Product Manager (Payment Gateway),,fyst.applytojob.com/apply/uljVBS9hWd/Senior-Product-Manager-Payment-Gateway,FYST,Senior Product Manager (Payment Gateway),Remote,Poland,GDPR,,yes
2025-09-21,Product Manager, Education & Learning,,jobs.ashbyhq.com/openai/74ee2eac-9970-42c2-9e65-e89e858ad6c0,OpenAI,Product Manager, Education & Learning,San Francisco,United States,OpenAI; Google Tag Manager,,yes
2025-09-21,Growth Product Manager,,hireforyou.peopleforce.io/careers/v/149855,hireforyou.pro,Growth Product Manager,Remote,,,yes
2025-09-21,Product Manager, Schools,,jobs.ashbyhq.com/padlet/6c0945ab-f704-4b7c-8677-402ebc0fbf6c,Padlet,Product Manager, Schools,San Francisco,United States,Presidio,,yes
2025-09-21,Senior Product Manager - Acumatica ERP,,velixo.applytojob.com/apply/RtCabuxkTV/Senior-Product-Manager-Acumatica-ERP,Velixo,Senior Product Manager - Acumatica ERP,Remote,Canada,Acumatica; Sage; Excel; Microsoft,,yes
2025-09-21,Principal Product Manager-B2B2C,,jobs.ashbyhq.com/phil/dcff543a-01a1-47f0-b0d1-f4b7af783453,PHIL,Principal Product Manager-B2B2C,Remote,United States,,,yes
2025-09-21,Product Manager,,capiogroup.applytojob.com/apply/lkR1YrjlRu/Product-Manager,Capio Group,Product Manager,Remote,United States,,,yes
2025-09-21,Senior Product Manager (Payment Gateway),,fyst.applytojob.com/apply/p56WbbcSnU/Senior-Product-Manager-Payment-Gateway,FYST,Senior Product Manager (Payment Gateway),Remote,,GDPR; Compliance,,yes
2025-09-21,Sr. Product Manager II (6043),,boards.greenhouse.io/metrostarsystems/jobs/7450356003,MetroStar,Sr. Product Manager II (6043),Remote,United States,ServiceNow,,yes
2025-09-21,Product Manager  	3Integrated Payments	4,,blazesolutions.applytojob.com/apply/CCQQjF9IZI/Product-Manager-Integrated-Payments,Blaze Solutions,Product Manager - Integrated Payments,Remote,,,yes
2025-09-21,Product Manager, Government + Secure Deployment,,jobs.ashbyhq.com/twelve-labs/4e08066f-9190-4758-86dc-c9c013a3e518,TwelveLabs,Product Manager, Government + Secure Deployment,San Francisco,United States,,,yes
2025-09-21,Product Manager, Video Search and Embeddings,,jobs.ashbyhq.com/twelve-labs/40499429-1e42-49a0-ad0b-64ce6dae3bbc,TwelveLabs,Product Manager, Video Search and Embeddings,San Francisco,United States,,,yes
2025-09-20,Senior Product Manager, Growth & Engagement,,boards.greenhouse.io/cartwheelcare/jobs/4909670007,Cartwheel,Senior Product Manager, Growth & Engagement,Remote,,,yes
2025-09-20,Project Manager / Product manager,,boards.greenhouse.io/whitetech/jobs/4678165101,WhiteTech,Project Manager / Product manager,Remote,,Confluence,,yes
2025-09-20,Founding Product Manager,,jobs.ashbyhq.com/outset/87a8e735-eca3-493f-befd-2fb6dc709111,Outset,Founding Product Manager,San Francisco,United States,Uber; Microsoft,,yes
2025-09-19,Azure DevOps Program/Product Manager,,imaginexdigital.applytojob.com/apply/FUP73rDuWQ/Azure-DevOps-ProgramProduct-Manager,ImagineX Consulting,Azure DevOps Program/Product Manager,Remote,United States,Azure,,no
2025-09-19,Digital Product Manager / Gestionnaire de produit numerique,,digitalmoment.applytojob.com/apply/QrAXLocXf4/Digital-Product-Manager-Gestionnaire-De-Produit-Numerique,Digital Moment,Digital Product Manager / Gestionnaire de produit numerique,Remote,,,no
2025-09-19,Sr. Product Manager,,foundationai.applytojob.com/apply/rH7LGLu6wj/Sr-Product-Manager,Foundation AI,Sr. Product Manager,Remote,United States,Confluence; Jira,,no
2025-09-19,Product Manager, Pricing,,jobs.ashbyhq.com/shepherd/3fc40e83-3dc6-4a89-a919-02541a97282a,Shepherd,Product Manager, Pricing,San Francisco,United States,Spark,,no
2025-09-19,Senior Privacy Product Manager,,boards.greenhouse.io/id5/jobs/5653651004,ID5,Senior Privacy Product Manager,Remote,,,no
2025-09-21,Director of Product Design - C2C,,ebay.wd5.myworkdayjobs.com/apply/job/san-jose/director-of-product-design---c2c_r0069277-1,eBay,Director of Product Design - C2C,San Francisco,United States,eBay,,,yes
2025-09-19,Head of Product, SaaS,,angaza.applytojob.com/apply/fGxzqjSdeo/Head-Of-Product-SaaS,Angaza Design,Head of Product, SaaS,Remote,,,no
2025-09-19,Head of Product Marketing,,jobs.ashbyhq.com/patch.io/342c47e9-10c5-4b7c-ada7-09bef26e3e13,Patch,Head of Product Marketing,San Francisco,United States,Go,,,no
2025-09-19,Head of Product Development & Strategy,,happymammoth.applytojob.com/apply/NMQH3WmU60/Head-Of-Product-Development-Strategy,Happy Koala,Head of Product Development & Strategy,Remote,,,no
2025-09-20,Director of Product Management, Athletics,,kindsight.applytojob.com/apply/9CdBmiqius/Director-Of-Product-Management-Athletics,Kindsight,Director of Product Management, Athletics,Remote,,,no
2025-09-20,Head of Product,,jobs.ashbyhq.com/superhuman/7cd706cb-6507-414f-87b1-1f9f7382138b,Superhuman,Head of Product,Remote,,,no
2025-09-19,Director of Product Marketing,,boards.greenhouse.io/talkiatry/3830fb88-7485-47fc-ae43-ce31c7d5eab5,Talkiatry,Director of Product Marketing,Remote,,,no
2025-09-20,Head of Product Development & Strategy,,happymammoth.applytojob.com/apply/4LPpc3fpX2/Head-Of-Product-Development-Strategy,Happy Koala,Head of Product Development & Strategy,Remote,,,no
2025-09-20,Head of Product Development & Strategy,,happymammoth.applytojob.com/apply/XM2r5ALOxe/Head-Of-Product-Development-Strategy,Happy Koala,Head of Product Development & Strategy,Remote,,,no
2025-09-20,Head of Product,,tali.applytojob.com/apply/8wcXtwE12s/Head-Of-Product,Tali AI,Head of Product,Remote,,,no
2025-09-20,Head of Product Development & Strategy,,happymammoth.applytojob.com/apply/bemNrOwCsu/Head-Of-Product-Development-Strategy,Happy Koala,Head of Product Development & Strategy,Remote,,,no
2025-09-20,Head of Product Development & Strategy,,happymammoth.applytojob.com/apply/ypnJbsd1n3/Head-Of-Product-Development-Strategy,Happy Koala,Head of Product Development & Strategy,Remote,,,no
2025-09-20,Head of Product Development & Strategy,,happymammoth.applytojob.com/apply/GvT9sgKrGB/Head-Of-Product-Development-Strategy,Happy Koala,Head of Product Development & Strategy,Remote,,,no
2025-09-20,Head of Product Development & Strategy,,happymammoth.applytojob.com/apply/P3KiPQJAci/Head-Of-Product-Development-Strategy,Happy Koala,Head of Product Development & Strategy,Remote,,,no
2025-09-20,Director of Product Marketing,,boards.greenhouse.io/corellium/jobs/5642547004,Corellium,Director of Product Marketing,Remote,,,no
2025-09-20,Director of Product Marketing,,goknit.applytojob.com/apply/IhW4XkRhGp/Director-Of-Product-Marketing,Knit,Director of Product Marketing,Remote,,,no
2025-09-21,Director of Product,,jobs.lever.co/alltrails/12340b23-68b0-41e2-accd-335efaa392ba,AllTrails,Director of Product,San Francisco,United States,,,yes
2025-09-21,Head of Product Marketing,,boards.greenhouse.io/regscale/jobs/4793925007,RegScale,Head of Product Marketing,Remote,,,yes
2025-09-19,Director of Product, Clinical Operations Platform,,boards.greenhouse.io/tailorcare2023/jobs/4596918006,TailorCare,Director of Product, Clinical Operations Platform,Remote,,,no
2025-09-20,Head of Product Marketing,,boards.greenhouse.io/logicgate/jobs/4602059005,LogicGate,Head of Product Marketing,Remote,,,yes
2025-09-21,Customer Success Manager - High Touch (East Coast),,jobs.ashbyhq.com/n8n/2b87bd9d-5354-40e2-9615-b72aa1b99dfa,n8n,Customer Success Manager - High Touch (East Coast),New York,United States,GitHub; n8n,,,yes
2025-09-21,Client Success Manager,,aokallc.applytojob.com/apply/aZ7XDkaRRL/Client-Success-Manager,Aoka,Client Success Manager,Remote,United States,,,yes
2025-09-21,Customer Success Manager - Low Touch  (East Coast),,jobs.ashbyhq.com/n8n/7caec1b3-91c4-4e96-b70d-def9733542e7,n8n,Customer Success Manager - Low Touch  (East Coast),New York,United States,n8n; GitHub,,,yes
2025-09-20,Client Success Representative (Remote, Contract),,boards.greenhouse.io/infuse/jobs/4610922005,INFUSE,Client Success Representative (Remote, Contract),Remote,,,,yes
2025-09-20,Client Success Representative (Remote, Contract),,boards.greenhouse.io/infuse/jobs/4610901005,INFUSE,Client Success Representative (Remote, Contract),Remote,,,,yes
2025-09-20,Senior National Customer Success Manager,,snapptinc.applytojob.com/apply/NgJMbZwXOW/Senior-National-Customer-Success-Manager,Snappt,Senior National Customer Success Manager,Remote,,,,yes
2025-09-20,Client Success Representative (Remote, Contract),,boards.greenhouse.io/infuse/jobs/4610926005,INFUSE,Client Success Representative (Remote, Contract),Remote,,,,yes
2025-09-20,Client Success Representative (Remote, Contract),,boards.greenhouse.io/infuse/jobs/4610929005,INFUSE,Client Success Representative (Remote, Contract),Remote,,,,yes
2025-09-20,Client Success Representative (Remote, Contract),,boards.greenhouse.io/infuse/jobs/4610913005,INFUSE,Client Success Representative (Remote, Contract),Remote,,,,yes
2025-09-20,Client Success Representative (Remote, Contract),,boards.greenhouse.io/infuse/jobs/4610914005,INFUSE,Client Success Representative (Remote, Contract),Remote,,,,yes
2025-09-21,Global Site Operations Program Manager,,adobe.wd5.myworkdayjobs.com/external_experienced/job/san-jose/global-site-operations-program-manager_r158755,Adobe,Global Site Operations Program Manager,San Francisco,United States,Adobe,,yes
2025-09-20,Technical Program Manager,,jobs.ashbyhq.com/anyscale/0c2602bc-3fb7-41a0-9837-afb03f7c9503,Anyscale,Technical Program Manager,San Francisco,United States,Anyscale,,yes
2025-09-19,Program Manager,,careworkforcesolutions.applytojob.com/apply/YnTs8hlgAV/Program-Manager,Care Workforce Solutions,Program Manager,Remote,United States,Google,,yes
2025-09-19,Program Manager,,nuvitek.pinpointhq.com/postings/7e08e24b-d7a5-4f3d-9b02-e6085fa47a6c,Nüvitek,Program Manager,Remote,United States,,,yes
2025-09-19,Program Manager,,innovapptive.applytojob.com/apply/RLn9WijZW9/Program-Manager,Innovapptive,Program Manager,Remote,United States,Freshworks; Facebook; Jira; IBM; Spotify; Flipkart; LinkedIn; SAP; Basecamp,,yes
2025-09-19,Program Manager,,overgroup.applytojob.com/apply/5XtXn47MEF/Program-Manager,Rev.io,Program Manager,Remote,United States,Rev.io; Jira; Microsoft; Asana,,yes
2025-09-19,"Program Manager, UX Research",,boards.greenhouse.io/asana/jobs/6923671,Asana,"Program Manager, UX Research",San Francisco,United States,Asana; Google Tag Manager,,yes
2025-09-20,Supervisor de Montagem (Auxiliares Elétricos),,gevernova.wd5.myworkdayjobs.com/only_confidential_executive_recruiting/job/remote/supervisor-de-montagem--auxiliares-eltricos-_r5020086,GE Vernova,Supervisor de Montagem (Auxiliares Elétricos),Remote,Brazil,,,yes
2025-09-20,"Head of Sales, Voyage AI & Ventures Ecosystem",,boards.greenhouse.io/mongodb/jobs/7245855,MongoDB,"Head of Sales, Voyage AI & Ventures Ecosystem",San Francisco,United States,Google Tag Manager; Atlas; Google Cloud; MongoDB Atlas; MongoDB; Microsoft Azure; AWS,,yes
2025-09-20,Senior FP&A Analyst (Cost of Revenue and Variable Costs),,turo.wd12.myworkdayjobs.com/turo_careers/job/san-francisco/senior-fp-a-analyst--cost-of-revenue-and-variable-costs-_r-102260,Turo,Senior FP&A Analyst (Cost of Revenue and Variable Costs),San Francisco,United States,Anaplan; NetSuite; SQL; Excel; Google,,yes
2025-09-20,Supervisor de Montagem (Auxiliares Elétricos),,gevernova.wd5.myworkdayjobs.com/vernova_externalsite/job/remote/supervisor-de-montagem--auxiliares-eltricos-_r5020086-1,GE Vernova,Supervisor de Montagem (Auxiliares Elétricos),Remote,Brazil,,,yes
2025-09-19,Costco Business Development Manager,,jonnypops.applytojob.com/apply/8SDjsv3hzu/Costco-Business-Development-Manager,JonnyPops,Costco Business Development Manager,Remote,United States,Microsoft; Nielsen,,yes
2025-09-21,Spanish Customer Care Associate,,planetart.applytojob.com/apply/sH76G6MAxm/Spanish-Customer-Care-Associate,PlanetArt,Spanish Customer Care Associate,Remote,,Slack; Intel; Hubstaff,,yes
2025-09-21,"Associate Director, Drug Product",,boards.greenhouse.io/imvtcorporation/jobs/5653167004,IMVT Corporation,"Associate Director, Drug Product",Remote,,,,yes
2025-09-21,Associate Media Director - Brand,,boards.greenhouse.io/goodwaygroup/jobs/5650766004,Goodway Group,Associate Media Director - Brand,Remote,,The Trade Desk,,yes
2025-09-21,Data Quality and Operations Associate,,theachievementnetwork.applytojob.com/apply/oz4KuJoN0F/Data-Quality-And-Operations-Associate,The Achievement Network,Data Quality and Operations Associate,Remote,,HubSpot; Tableau; Salesforce,,yes
2025-09-21,Asset Management Associate,,jobs.lever.co/bisnow/d8adb5d8-247e-4210-b5c1-77bda21cc3b4,Bisnow,Asset Management Associate,Boston,United States,Excel,,yes
2025-09-21,Regulatory Risk and Reporting Associate,,baincapital.wd1.myworkdayjobs.com/external_public/job/boston/regulatory-risk-and-reporting-associate_req_107991-6,Bain Capital,Regulatory Risk and Reporting Associate,Boston,United States,,,yes
2025-09-21,Portfolio Compliance Associate,,cambridgeassociates.wd5.myworkdayjobs.com/cambridge_associates/job/boston/portfolio-compliance-associate_jr0000030-1,Cambridge Associates,Portfolio Compliance Associate,Boston,United States,Excel; Microsoft; Bloomberg; Castle,,yes
2025-09-20,"Quantitative Developer, Associate - Securitized Products",,clearwateranalytics.wd1.myworkdayjobs.com/clearwater_analytics_careers/job/new-york-office/quantitative-developer--associate---securitized-products_r10840,Clearwater Analytics,"Quantitative Developer, Associate - Securitized Products",New York,United States,Bloomberg; Python; Athena,,yes
2025-09-20,Real Estate Finance Associate / Analyst - REMOTE HIRE - US Company - $1500 - $2000,,pnet.co.za/jobs--real-estate-finance-associate-analyst-remote-hire-us-company-1500-2000-remote-somewhere--4068381-inline.html,Somewhere,Real Estate Finance Associate / Analyst - REMOTE HIRE - US Company - $1500 - $2000,Remote,United States,Excel,,yes
2025-09-20,Medical Billing Associate - Patient Services,,jobs.lever.co/lunaphysicaltherapy/31d46ea4-b50a-486c-a75d-cb51a6c191aa,Luna Physical Therapy,Medical Billing Associate - Patient Services,REMOTE,,,,yes
2025-09-20,"Senior Research Associate/ Research Associate, Platform",,boards.greenhouse.io/manifoldbio/jobs/4913427007,Manifold Bio,"Senior Research Associate/ Research Associate, Platform",Boston,United States,Teachable; Manifold,,yes
2025-09-21,Billing & Collections Data Analyst,,boards.greenhouse.io/toast/jobs/7239473,Toast,Billing & Collections Data Analyst,Remote,,Power BI; Hex; Oracle; Looker; SQL; Snowflake,,yes
2025-09-21,Mid Marketing Data Analyst,,happymammoth.applytojob.com/apply/wPaqkvutxC/Mid-Marketing-Data-Analyst,Happy Koala,Mid Marketing Data Analyst,Remote,France,SQL; Google BigQuery; Excel; Power BI; Looker,,yes
2025-09-21,Mid Marketing Data Analyst,,happymammoth.applytojob.com/apply/Xi3Z1x078w/Mid-Marketing-Data-Analyst,Happy Koala,Mid Marketing Data Analyst,Remote,Denmark,Power BI; Google; SQL; Looker; Excel,,yes
2025-09-21,Mid Marketing Data Analyst,,happymammoth.applytojob.com/apply/sWP6vzW3DE/Mid-Marketing-Data-Analyst,Happy Koala,Mid Marketing Data Analyst,Remote,Bosnia And Herzegovina,Looker; Excel; Power BI; SQL; Google,,yes
2025-09-21,Data Scientist,,boards.greenhouse.io/distantjob/jobs/8173090002,DistantJob,Data Scientist,Remote,,NumPy; SQL; Python; ETL; Power BI; Google,,yes
2025-09-21,Data Scientist,,liveramp.wd5.myworkdayjobs.com/liverampcareers/job/san-francisco/data-scientist_jr011767,LiveRamp,Data Scientist,San Francisco,United States,SQL; scikit-learn; Spark SQL; NumPy; Spark; Python; LiveRamp,,yes
2025-09-21,Machine Learning Engineer (Remote),,jobs.ashbyhq.com/output/675db22c-8a5a-4a6e-a6c0-277edac3d87c,Output Biosciences,Machine Learning Engineer (Remote),Remote,United States,Python; TensorFlow,,yes
2025-09-21,Machine Learning Engineer,,boards.greenhouse.io/oddball/jobs/7445579003,Oddball,Machine Learning Engineer,Remote,,AWS; Databricks; Power BI; scikit-learn; TensorFlow; PyTorch; Python; ETL; Spark; Jupyter,,yes
2025-09-21,Network Pricing Data Analyst,,boards.greenhouse.io/capitalrx/jobs/4928438008,Capital Rx,Network Pricing Data Analyst,Remote,,AWS; JSON; SQL; Java; Excel,,yes
2025-09-21,Senior Data Scientist,,miovision.applytojob.com/apply/PqGPpAJLYn/Senior-Data-Scientist,Miovision,Senior Data Scientist,Remote,,Git; AWS; Looker; Snowflake; Streamlit; Python; SQL; JavaScript; C#,,yes
2025-09-21,Mid Marketing Data Analyst,,happymammoth.applytojob.com/apply/sY8DkDxYW3/Mid-Marketing-Data-Analyst,Happy Koala,Mid Marketing Data Analyst,Remote,Italy,Excel; Power BI; Looker; Google BigQuery; SQL,,yes
2025-09-21,"Senior Data Analyst, Product",,boards.greenhouse.io/calendly/jobs/8163001002,Calendly,"Senior Data Analyst, Product",Remote,,Python; Calendly; Hex; SQL,,yes
2025-09-21,Mid Marketing Data Analyst,,happymammoth.applytojob.com/apply/icX2LSs34Z/Mid-Marketing-Data-Analyst,Happy Koala,Mid Marketing Data Analyst,Remote,Sweden,Looker; SQL; Power BI; Google; Excel,,yes
2025-09-21,Mid Marketing Data Analyst,,happymammoth.applytojob.com/apply/PZB6Ehbtid/Mid-Marketing-Data-Analyst,Happy Koala,Mid Marketing Data Analyst,Remote,Armenia,SQL; Excel; Google; Power BI; Looker,,yes
2025-09-20,Senior Machine Learning Engineer,,boards.greenhouse.io/federato/jobs/4928316008,Federato,Senior Machine Learning Engineer,Remote,,Veeva; Salesforce; Box; Zoom; Kubeflow,,yes
2025-09-20,Senior Data Analyst,,boards.greenhouse.io/urbancompass/jobs/7263508,Compass,Senior Data Analyst,San Francisco,United States,PySpark; Scala; Databricks; SQL; Looker; Microsoft; Power BI; Python; Maven; Tableau,,yes
2025-09-20,"Data Analyst, Marketing",,turo.wd12.myworkdayjobs.com/turo_careers/job/san-francisco/data-analyst--marketing_r-102257,Turo,"Data Analyst, Marketing",San Francisco,United States,SQL; Google; Go; Python; Power BI,,yes
2025-09-20,Data Analyst,,current-vacancies.com/jobs/advert/3963235?cid=3287,One YMCA,Data Analyst,Remote,,Signpost; GDPR; Accessibility,,yes
2025-09-20,Senior Data Analyst,,jobs.ashbyhq.com/onoshealth/96e478f8-f111-46bc-97ec-50d16a6cbf21,Onos Health,Senior Data Analyst,San Francisco,United States,Tableau; SQL,,yes
2025-09-20,"Senior Clinical Data Scientist, Data Products & Insights",,jobs.lever.co/npowermedicine/f995742b-9037-4406-aa76-95df710634d6,N-Power Medicine,"Senior Clinical Data Scientist, Data Products & Insights",Remote,,Shiny,,yes
2025-09-20,Data Analyst Jr.,,ansiblegovernmentsolutions.applytojob.com/apply/HGBJdIIJSd/Data-Analyst-Jr,Ansible Government Solutions,Data Analyst Jr.,Remote,United States,Sigma; Ansible; Power BI; Excel,,yes
2025-09-19,Risk Data Analyst,,jobs.ashbyhq.com/imprint/925a3502-357e-4258-9a98-ec0f6d2a6c15,Imprint,Risk Data Analyst,Remote,United States,Tableau; Rakuten; SQL; Booking.com; Python; Airflow; dbt,,yes
2025-09-19,Principal Healthcare Data Analyst,,recruitingbypaycor.com/career/JobIntroduction.action?clientId=8a7883d077592447017763c3f0f91146&id=8a7887ac995981fd01995e481d56397f,b.well Connected Health,Principal Healthcare Data Analyst,Remote,,Python; SQL; FHIR; Databricks,,yes
2025-09-19,Mid Marketing Data Analyst,,happymammoth.applytojob.com/apply/vTmSZskfro/Mid-Marketing-Data-Analyst,Happy Koala,Mid Marketing Data Analyst,Remote,Lithuania,Excel; SQL; Google BigQuery; Power BI; Looker,,yes
2025-09-19,"Senior Manager, Machine Learning Engineering",,boards.greenhouse.io/gofundme/jobs/7255386,GoFundMe,"Senior Manager, Machine Learning Engineering",Remote,,Python,,yes
2025-09-19,Mid Marketing Data Analyst,,happymammoth.applytojob.com/apply/9b4EDrSEnr/Mid-Marketing-Data-Analyst,Happy Koala,Mid Marketing Data Analyst,Remote,Germany,Google; Power BI; Excel; Looker; SQL,,yes
2025-09-19,Finance Assistant | Bookkeeper | Data Analyst | Reports Specialist,,coworq.applytojob.com/apply/SN0bMdW9cI/Finance-Assistant-Bookkeeper-Data-Analyst-Reports-Specialist,CoWorq,Finance Assistant | Bookkeeper | Data Analyst | Reports Specialist,Remote,,,,yes
2025-09-19,Mid Marketing Data Analyst,,happymammoth.applytojob.com/apply/96QWMbIvFk/Mid-Marketing-Data-Analyst,Happy Koala,Mid Marketing Data Analyst,Remote,Italy,Power BI; Looker; SQL; Excel; Google BigQuery,,yes
2025-09-21,Senior Full Stack Engineer (US),,jobs.lever.co/airdna/52407dee-a35f-4331-945c-0a3675b2e7fe,AirDNA,Senior Full Stack Engineer (US),Remote,,Python; GitLab CI; Redis; Next.js; Kubernetes; SQL; React; Docker; AWS; TypeScript; PostgreSQL,,yes
2025-09-21,"Senior Software Engineer, Full-stack",,jobs.ashbyhq.com/onebrief/7d6a2098-0889-487a-9ced-280b359ae376,Onebrief,"Senior Software Engineer, Full-stack",Remote,United States,TypeScript; Kubernetes; Node.js; React; AWS; Redis; PostgreSQL,,yes
2025-09-21,Senior Backend Engineer,,jobs.lever.co/heartbeathealth/c6c8d211-d83b-485e-aa2c-f277a6bacd48,Heartbeat Health,Senior Backend Engineer,remote,,Go; Actix; Heartbeat; Kotlin; Rust; AWS; OpenAPI; Serde; FHIR,,yes
2025-09-21,"Staff Backend Engineer, DevOps",,boards.greenhouse.io/pulley/jobs/4926339008,Pulley,"Staff Backend Engineer, DevOps",Remote,,Go; Stripe,,yes
2025-09-21,Sr Software Engineer,,henryscheinone.applytojob.com/apply/curb9iq6ow/Sr-Software-Engineer,Henry Schein One,Sr Software Engineer,Remote,,jQuery; Backbone.js; C++; HTML5; JavaScript; GitLab; Microsoft; SQL; PostgreSQL; Jira; C#,,yes
2025-09-20,Master Software Engineer,,boards.greenhouse.io/clarityinnovates/jobs/4896198007,Clarity Innovations,Master Software Engineer,Remote,,SonarQube; Docker; Kubernetes; Spring Boot,,yes
2025-09-20,Sr Software Engineer (Salesforce),,jobs.lever.co/nava/b76d3c3b-ae12-4975-b242-e2c8fa329c1a,Nava,Sr Software Engineer (Salesforce),Remote,,Jenkins; .NET; GitHub; Tableau; Azure; Salesforce; LinkedIn; Python; ETL; Ruby,,yes
2025-09-20,"Senior Full-Stack/Backend Engineer (Python & JavaScript) – Remote, Contract",,boards.greenhouse.io/infuse/jobs/4610454005,INFUSE,"Senior Full-Stack/Backend Engineer (Python & JavaScript) – Remote, Contract",Remote,,Zoom; AWS; PostgreSQL; Node.js; Telegram; Git; MongoDB; Vue.js; S3; GraphQL; Python; React; Redis,,yes
2025-09-20,"Senior Full-Stack/Backend Engineer (Python & JavaScript) – Remote, Contract",,boards.greenhouse.io/infuse/jobs/4610460005,INFUSE,"Senior Full-Stack/Backend Engineer (Python & JavaScript) – Remote, Contract",Remote,,Vue.js; Python; PostgreSQL; GraphQL; S3; AWS; Node.js; Zoom; Telegram; MongoDB; Redis; React; Git,,yes
2025-09-20,"Senior Full-Stack/Backend Engineer (Python & JavaScript) – Remote, Contract",,boards.greenhouse.io/infuse/jobs/4610450005,INFUSE,"Senior Full-Stack/Backend Engineer (Python & JavaScript) – Remote, Contract",Remote,,Node.js; Zoom; Telegram; MongoDB; PostgreSQL; Git; AWS; S3; Redis; React; Python; GraphQL; Vue.js,,yes
2025-09-20,"Senior Full-Stack/Backend Engineer (Python & JavaScript) – Remote, Contract",,boards.greenhouse.io/infuse/jobs/4610459005,INFUSE,"Senior Full-Stack/Backend Engineer (Python & JavaScript) – Remote, Contract",Remote,,PostgreSQL; Node.js; Redis; Zoom; S3; GraphQL; React; Python; Git; Vue.js; AWS; Telegram; MongoDB,,yes
2025-09-20,Full Stack Engineer- Level 6,,evoportalus.tracker-rms.com/opportunity/litejob?db=westcoastconsulting&id=5778,West Coast Consulting,Full Stack Engineer- Level 6,Remote,,React; Git; Memcached; MySQL; Maven; Oracle; Jenkins; Java; Spring Boot; JavaScript; Kafka; TypeScript,,yes
2025-09-20,"Senior Full-Stack/Backend Engineer (Python & JavaScript) – Remote, Contract",,boards.greenhouse.io/infuse/jobs/4610449005,INFUSE,"Senior Full-Stack/Backend Engineer (Python & JavaScript) – Remote, Contract",Remote,,React; Zoom; GraphQL; Python; MongoDB; S3; Vue.js; Telegram; Redis; PostgreSQL; AWS; Node.js; Git,,yes
2025-09-20,"Senior Full-Stack/Backend Engineer (Python & JavaScript) – Remote, Contract",,boards.greenhouse.io/infuse/jobs/4610440005,INFUSE,"Senior Full-Stack/Backend Engineer (Python & JavaScript) – Remote, Contract",Remote,,Python; PostgreSQL; Redis; Vue.js; Node.js; AWS; Zoom; S3; MongoDB; Git; GraphQL; Telegram; React,,yes
2025-09-20,"Senior Full-Stack/Backend Engineer (Python & JavaScript) – Remote, Contract",,boards.greenhouse.io/infuse/jobs/4610446005,INFUSE,"Senior Full-Stack/Backend Engineer (Python & JavaScript) – Remote, Contract",Remote,,React; AWS; Vue.js; Zoom; Telegram; PostgreSQL; S3; Node.js; GraphQL; MongoDB; Redis; Python; Git,,yes
2025-09-20,"Senior Full-Stack/Backend Engineer (Python & JavaScript) – Remote, Contract",,boards.greenhouse.io/infuse/jobs/4610457005,INFUSE,"Senior Full-Stack/Backend Engineer (Python & JavaScript) – Remote, Contract",Remote,,MongoDB; React; S3; Telegram; Node.js; Python; AWS; Vue.js; Zoom; Git; PostgreSQL; GraphQL; Redis,,yes
2025-09-20,"Senior Full-Stack/Backend Engineer (Python & JavaScript) – Remote, Contract",,boards.greenhouse.io/infuse/jobs/4610456005,INFUSE,"Senior Full-Stack/Backend Engineer (Python & JavaScript) – Remote, Contract",Remote,,Zoom; GraphQL; Git; AWS; Vue.js; MongoDB; Python; PostgreSQL; Redis; Node.js; React; Telegram; S3,,yes
2025-09-20,"Senior Full-Stack/Backend Engineer (Python & JavaScript) – Remote, Contract",,boards.greenhouse.io/infuse/jobs/4610447005,INFUSE,"Senior Full-Stack/Backend Engineer (Python & JavaScript) – Remote, Contract",Remote,,Zoom; Vue.js; Python; GraphQL; Telegram; React; MongoDB; AWS; S3; Node.js; Git; Redis; PostgreSQL,,yes
2025-09-20,"Senior Full-Stack/Backend Engineer (Python & JavaScript) – Remote, Contract",,boards.greenhouse.io/infuse/jobs/4610441005,INFUSE,"Senior Full-Stack/Backend Engineer (Python & JavaScript) – Remote, Contract",Remote,,PostgreSQL; Redis; Node.js; React; Zoom; MongoDB; S3; Telegram; Git; AWS; GraphQL; Vue.js; Python,,yes
