Event Name,Event Time,Status,External Url
Best Product Manager Job Search Trends & Strategies for Q3 2022,"Jul 27, 2022 05:00 PM - Jul 27, 2022 05:30 PM",RELINQUISHED,
"Inside the New Hiring Hoax: Ghosts, Fakes, & AI Tricks","Aug 21, 2025 07:00 PM - Aug 21, 2025 08:00 PM",APPROVED,
Advantages of Working at a Midsize Company for PMs with Checkr Senior PM,"Jul 13, 2022 05:00 PM - Jul 13, 2022 05:30 PM",RELINQUISHED,
Companies Hiring Product Managers During 2022 Layoffs and Recession,"May 25, 2022 05:00 PM - May 25, 2022 05:30 PM",RELINQUISHED,
4 Ways to Speed Up Your Product Management Job Hunt,"Jul 20, 2022 05:00 PM - Jul 20, 2022 05:30 PM",RELINQUISHED,https://bit.ly/3c8B9ZA
How to Answer the Most Common Technical Product Manager Interview Questions,"Apr 27, 2022 05:00 PM - Apr 27, 2022 05:30 PM",RELINQUISHED,
Step by Step Guide to Writing the Ultimate Product Manager Resume,"Apr 20, 2022 05:00 PM - Apr 20, 2022 05:30 PM",RELINQUISHED,
"NYU IMA 7th Annual Summit ""CONNECT:ED - Adapting Through the Unpredictable""","Mar 04, 2021 02:00 PM - Mar 04, 2021 08:00 PM",APPROVED,https://bit.ly/IMAsummit
Top 5 Product Case Study Interview Questions with Answers in 2022,"May 11, 2022 05:00 PM - May 11, 2022 05:30 PM",RELINQUISHED,
Top 9 Product Manager Behavioral Interview Questions with Answers in 2022,"Jun 22, 2022 05:00 PM - Jun 22, 2022 05:30 PM",RELINQUISHED,
FREE Job Search Office Hours: Hosted by Warmer Jobs & Careerspan,"Jul 02, 2025 06:00 PM - Jul 02, 2025 07:00 PM",APPROVED,
Regeneration Pollination Online Networking - Bonus Event,"Jul 28, 2022 10:00 PM - Jul 28, 2022 11:30 PM",RELINQUISHED,https://us02web.zoom.us/meeting/register/tZIkdOCupjMvEtW1qo5P7cBK1bcmUithNa--
Young Entrepreneurs - Speed Networking on Zoom,"Jun 27, 2023 05:00 PM - Jun 27, 2023 06:00 PM",APPROVED,https://us02web.zoom.us/j/85799210600
