Using AI as Your SEO Assistant,"<p>If you want to get your site noticed by search engines, you need to get good at SEO. And who better to have as your SEO assistant than someone who speaks computer as their first language? We're talking ChatGPT, of course. Join Dave Birss, innovator, AI wrestler, and web developer as he shows you how to use generative AI to help you with your SEO strategies and tactics. He'll even share a number of useful prompts that will help you find powerful keywords, generate content ideas, and help you create more SEO-friendly copy.
</p><p>This course was created by Dave Birss. We are pleased to offer this training in our library.",Course,2023-11-09 16:34 UTC,N/A,false,N/A,
Prompt Engineering and AI Agents with ChatGPT,"Explore how OpenAI's updates transform prompt engineering with new agentic features. Learn to use variables and identifiers for reusable prompts and convert them into custom GPT agents. Master the @ mentioning system for task-specific GPTs, and discover advanced features like memory management, vision, audio processing, and custom instructions.",Course,2025-08-07 15:09 UTC,N/A,false,N/A,
What Athletes Can Teach Us About Mental Health,"<p>Strong mental skills are foundational to an athlete's career—regardless of their sport. If you have great physical talent but can't manage your mental game effectively, you won't reach your full potential. And the better you manage your mind, the better you're perceived! In this course, performance psychologist Alex Auerbach, who works with the Toronto Raptors, shares practical wisdom to help athletes navigate their mental challenges and maintain high performance. He discusses how to think about performance and influence it positively. Alex also delves into cultivating presence and routine, connecting to motivation and purpose, understanding your ""why,” and dealing with imposter syndrome and failure. He also reveals strategies to maximize your potential and stay present every day. Finally, he shows how your team and environment can affect your performance.</p><p>
This course was created by Morra Aarons-Mele of <i>The Anxious Achiever</i>. We are pleased to offer this insightful discussion in our library.",Course,2024-11-12 22:23 UTC,N/A,false,N/A,
Responding to Unreasonable Customer Demands,"<p>Looking to improve your customer service skills? In this course, customer service expert Vince Lopiccola teaches essential strategies to handle unreasonable customer demands effectively. Learn how to maintain professionalism when navigating difficult customer interactions using de-escalation techniques, active listening, and boundary setting. By the end of this course, you'll be prepared to utilize practical strategies to enhance customer satisfaction and maintain composure in challenging situations.</p>
<p>This course was created by <a href=""https://www.onlymadecraft.com"" target=""_blank"">Madecraft</a>. We are pleased to host this training in our library.</p>                  
<img src=""https://media.licdn.com/media/AAYAAgCwAAoAAQAAAAAAAHppnBQxgeyWS2CsU3aDDPcMgw.jpg"" alt=""Company logo for Madecraft; the letter M configured as part of a printing press"" width=""20%"" height=""20%"" />",Course,2025-01-18 12:47 UTC,N/A,false,N/A,
Career Advice from Some of the Biggest Names in Business,"What if you could get career advice from the world's most influential thinkers, leaders, and innovators? People who have run the top companies, created the most beloved brands, transformed industries, and changed the world? Now you can. This course brings together the best insights from our collection of interviews with LinkedIn Influencers. CEOs such as Richard Branson, Bill Gates, Indra Nooyi, and Meg Whitman reveal what it takes to get your foot in the door and then work your way up. Discover why Starbucks founder Howard Schultz thinks that conviction is so critical, how Oprah found her vision, and what actress Priyanka Chopra does to find the next challenge. Each interview provides short and thoughtful tips you can use to propel your own career in the right direction.",Course,2021-04-27 22:51 UTC,N/A,false,N/A,
How to Use Generative AI: Building an AI-First Mindset,"<p>Creating real impact with AI means understanding what generative AI is capable of today—and using that knowledge to stay ahead of future developments. Regardless of your industry, role, and experience, AI can transform your personal and professional development. If you want to learn how to unlock your full potential with AI, this course is for you.
</p><p>
In this course, AI thought leader, advisor, and investor Allie K. Miller provides her insights and guidance on how to thrive in the AI age. She shares real-world examples of generative AI tools in action, as well as her most-used framework to leverage AI to generate added value. Learn how to seamlessly integrate AI into your workflows, enhancing both individual and team productivity. Get the knowledge and tools to use AI for strategic planning, decision-making, and creative problem-solving. By adopting an AI-first mindset, you’ll be better prepared to future-proof your career and lead AI-driven transformations within your organization.",Course,2025-08-01 13:58 UTC,N/A,false,N/A,
Think Like a Lawyer to Make Decisions and Solve Problems,"Why would any non-lawyer want to think like a lawyer? What’s the benefit of thinking like a lawyer? In this course, law professor Kim Wehle explains how thinking like a lawyer and employing the legal method of decision making helps eliminate emotional reactivity, confirmation bias, and other decision-making pitfalls in favor of evidentiary-based analysis. Kim highlights key aspects of decision making and problem solving, like identifying stakeholders affected in any decision, the importance of asking the right questions, identifying and prioritizing your goals, and exercising critical listening skills.<br>
When you think like a lawyer, the result is more informed, thorough, and effective decisions that you can feel good about, regardless of the circumstances.",Course,2022-11-11 13:58 UTC,N/A,false,N/A,
Using Snowflake with Tableau,"Did you know that you can use Tableau and Snowflake together to create more efficient, secure, and high-performing data solutions? In this course, instructor Tim Ngwena provides an in-depth exploration of the synergies between the leading data visualization tool and the popular cloud-based data warehousing platform. Explore a wide range of topics, from basic connectivity and data handling to advanced techniques in security, performance tuning, and workbook design. Ideal for data analysts, business intelligence developers, data engineers, database administrators, and data architects, this course equips you with both the theoretical knowledge and practical skills to leverage the power of Tableau and Snowflake in tandem.",Course,2025-09-23 05:42 UTC,N/A,false,N/A,
Product Management Insights,"<p>Looking to ramp up your skill set as a high-performing product manager? Get up and running today in this bootcamp-style course with LinkedIn product management experts Hari Srinivasan, Gyanda Sachdeva, and Damien Coullon. Join Hari, Gyanda, and Damien as they draw insights from their own experiences and give you a hands-on overview of some of the most crucial skills a PM needs to know to be successful at a large organization.</p><p>Learn how to perform at a high level—in any business context—and build products that resonate with your users and customers. Get tips for defining a problem statement, examining your audience and customer base, prioritizing problems in light of your customers’ and organization’s needs, driving feature growth, and dealing with conflict. Along the way, Hari, Gyanda, and Damien offer practical strategies for growth and success in a product ecosystem, attending to the unique considerations of both your enterprise and consumers, and communicating clearly and effectively with purpose.</p>",Course,2025-09-05 05:32 UTC,N/A,false,N/A,
Developing Your Emotional Intelligence,"<p>Emotional intelligence can help you build strong relationships at work and respond to change effectively. Psychologist and author Dr. Gemma Leigh Roberts explains what emotional intelligence (EQ) is and why it's important. She helps you become more self-aware so that you can identify triggers that may hijack your performance. Gemma also helps you align your intentions and your impact so that you can build collaborative relationships. </p><p>
This course is part of these Professional Certificates:<br>
<ul>
<li><a href=""https://www.linkedin.com/learning/paths/becoming-a-manager-professional-certificate-by-linkedin-learning"">Becoming a Manager</a> from LinkedIn Learning.</li>
<li><a href=""https://www.linkedin.com/learning/paths/human-skills-for-managers-professional-certificate-by-linkedin-learning"" target=""_blank"">Human Skills for Managers</a> from LinkedIn Learning.</li>
<li><a href=""https://www.linkedin.com/learning/paths/professional-soft-skills-learning-pathway"" target=""_blank"">Professional Soft Skills Learning Pathway</a> from Microsoft.</li>
</ul></p>",Course,2024-01-10 16:09 UTC,N/A,false,N/A,
Drawing Vector Graphics: Hand Lettering,"Typography and lettering are distinct yet intimately interwoven art forms. While typography relies on established fonts, lettering relies on the hand of an artist. However, since hand lettering, like typography, is usually destined for print or the web, it's critical for illustrators to be able to transform their letterform drawings into pristine vector graphics. In this installment of <em>Drawing Vector Graphics</em>, Von Glitschka takes members through the entire creative process of hand lettering: starting with analog drawing tools, then using Adobe Illustrator to turn his drawings into vector graphics that can be further customized and scaled up or down. Von also introduces styling tips to create more compelling graphics and examples from some of the industry's best artists.",Course,2025-02-17 20:04 UTC,N/A,false,N/A,
"Business Etiquette: Phone, Email, and Text","Business etiquette skills are just as important today as ever—they impact an individual's communication, confidence, and career. In this course, etiquette expert Toni Purvis guides you through essential etiquette for business communications. Learn about email etiquette, with topics including subject lines, using gender and  pronouns respectfully, tricky elements of bcc and cc, and crafting an email that in content, tone, and timing takes the recipient into consideration. Explore the dos and don'ts of professional text conversations and phone communication. Plus, dive into the etiquette of written communications, such as  business letters, exchanging contact information, giving thanks, and expressing sympathy. Business etiquette is all about building positive relationships that create memorable interactions, and this course can help you level up your skills.",Course,2024-07-17 02:51 UTC,N/A,false,N/A,
Breaking Free From Micromanagement,"<p>Strong leadership skills are foundational to a successful career—regardless of your role. An effective leadership approach is key for your team to reach its full potential. In this course, leadership professor Dr. Julia Milner from EDHEC Business School shares practical wisdom to help leaders recognize, handle, and prevent micromanaging in the workplace. Dr. Julia Milner is a renowned leadership expert with extensive experience in coaching and developing leaders. Find out how to recognize the underlying need for control and anxiety that often drives micromanaging behavior. Delve into the negative impacts of being micromanaged on mental health and productivity. Get started with universal principles such as recognizing micromanaging tendencies and developing strategies to prevent them. Explore techniques for handling micromanaging behavior effectively and promoting a healthier work environment. Plus, discover ways to create a supportive team culture that fosters trust and autonomy. </p>

<p>This course was created by Morra Aarons-Mele. We are pleased to host this training in our library.</p>",Course,2024-12-04 13:01 UTC,N/A,false,N/A,
Learning Python (2020),"Python—the popular and highly readable object-oriented language—is both powerful and relatively easy to learn. Whether you're new to programming or an experienced developer, this course can help you get started with Python. Joe Marini provides an overview of the installation process, basic Python syntax, and an example of how to construct and run a simple Python program. Learn to work with dates and times, read and write files, and retrieve and parse HTML, JSON, and XML data from the web.",Course,2021-01-24 21:18 UTC,N/A,false,N/A,
Editing Mastery: How to Edit Writing to Perfection,"Most editors can capably fix the spelling, grammar, punctuation, and typos in a piece of writing. It takes a different skill set to turn dry, disorganized prose into writing that is beautifully organized and bursting with life and energy. In this course, instructor Shani Raja acquaints you with a powerful technique—deep editing—that can help you transform nearly any piece of nonfiction writing into magnificent, sparkling prose. The deep editing technique forces you to consider every aspect of a document, ensuring that quality gets embedded into each pore of the writing. Discover how to fine-tune the content, structure, style, and presentation of a document so that the final product shines.",Course,2022-07-14 15:33 UTC,N/A,false,N/A,
Automate and Innovate with Chat GPT AI Agents and Zapier,"Explore the future of work productivity: leveraging AI agents in tandem with Zapier. In this course, instructor Jules White shows you how to use ChatGPT, AI agents, and Zapier to build automation tools that can handle complex tasks, boost your efficiency, and help you get more done faster with less stress. Along the way, gather insights on how to harness these tools to streamline your workflow and focus on what matters most. Upon completing this course, you’ll be prepared to automate and innovate, transforming the way you work to achieve your goals.",Course,2025-08-02 19:40 UTC,N/A,false,N/A,
Demystifying ChatGPT and Generative AI: What Every Professional Needs to Know,"Unlock the secrets of AI in this course with instructor Jules White. This course breaks down complex AI concepts into simple, easy-to-understand lessons, making generative AI accessible to everyone. Learn how to effectively integrate ChatGPT into your professional toolkit, boosting productivity, creativity, and innovation. Business leaders will gain strategic insights to effectively innovate and drive their organizations forward. Whether you're new to AI or looking to enhance your understanding, this course provides the essential knowledge and skills you need to stay ahead in the evolving digital landscape.",Course,2025-03-03 16:43 UTC,N/A,false,N/A,
Autonomous Transformation: Create a More Human Future with AI,"<p>As we continue our journey into a world of artificial intelligence and continual disruption, somehow many of our ideas about leadership and how businesses should be run are still stuck in the past. In this audiobook summary of his book Autonomous Transformation: Creating a More Human Future in the Era of Artificial Intelligence, Brian Evergreen examines the transition from analog to digital paradigms, and looks beyond that to the next step: a transformation from digital to autonomous—and what system of leadership is needed to harness the economic and societal potential of technology in the era of artificial intelligence. Brian talks about the importance of transforming our current leadership systems, explains how you can envision your organization’s future, make decisions based on reason (not data), and more.
</p><p> 
Note: This audiobook summary was created by Next Big Idea Club. We are pleased to host this content in our library.",Course,2025-10-28 13:31 UTC,N/A,false,N/A,
Nano Tips for Understanding Your Analytics with Shadé Zahrai,"<p>Welcome to our <i>Nano Tips</i> series, where LinkedIn Learning creators deliver impactful lessons in literally seconds. In this installment, join award-winning leadership strategist and peak performance specialist Shadé Zahrai as she shares practical, actionable advice on leveraging the power of LinkedIn Analytics.</p><p>Learn how to use LinkedIn Analytics to develop data-driven strategies to analyze audience trends, refine messaging, and optimize content, ensuring impactful engagement and meaningful connections with your followers. Shadé shows you how and why applying data-driven insights can let you more effectively plan future posts, troubleshoot underperforming content, build lasting relationships with your audience, and more. By the end of this course, you’ll be prepared to create with more intentionality, instead of just chasing virality or feeling like analytics is guesswork.</p><p>This course was created by Shadé Zahrai. We are pleased to host this training in our library.</p>",Course,2025-09-24 06:51 UTC,N/A,false,N/A,
Developing Self-Awareness,"While a multitude of factors can go into the making of a successful person, nearly all individuals who achieve high levels of personal and professional success have a keen sense of self-awareness. In this course, learn how to become more self-aware in order to develop yourself personally and enhance career progression. Organizational psychologist Gemma Roberts helps you learn how to develop your self-awareness so that you can understand how others see you, and better align your actions with your intentions. She explains how to identify beliefs to enhance self-awareness, step outside of yourself to gain a different perspective, leverage a self-awareness action plan, and more.",Course,2022-07-25 10:21 UTC,N/A,false,N/A,
CONTENT METADATA NO LONGER EXISTS - urn:li:lyndaCourse:2806713,CONTENT METADATA NO LONGER EXISTS - urn:li:lyndaCourse:2806713,Course,2019-12-19 05:34 UTC,N/A,false,N/A,
Project Management: Healthcare Projects (2016),"Healthcare projects have their own unique set of needs and challenges, including privacy concerns and regulatory constraints. Learn how to effectively manage these challenges on healthcare projects large and small in this course with project management expert Bob McGannon. Bob goes over specific approaches to setting project goals, scheduling tasks, managing stakeholders, and mitigating the risks and challenges that are common to the medical field. Then he proposes some specific challenges to bring the concepts to life and offers solutions so you can compare your approach with his recommendations.",Course,2020-05-09 12:43 UTC,N/A,false,N/A,
SQL Essential Training (2019),"Knowing how to code and manage relational databases and database-driven applications is a valuable skill for any career in tech. Completely updated for 2019, <i>SQL Essential Training</i> is designed to help users understand the most common language for database wrangling, SQL. All the lessons have been recorded in SQLiteStudio, an intuitive and easy-to-install database manager. Instructor Bill Weinman teaches all the major features of SQL: creating tables; defining relationships; manipulating strings, numbers, and dates; using triggers to automate actions; and using subselects and views. He offers a solid working knowledge of the language and shows how to retrieve and manage data efficiently. The final chapter includes a real-world example of building a simple application using SQL.<br><br>

This course was created by Bill Weinman. We are pleased to offer this training in our library.",Course,2021-01-11 20:18 UTC,N/A,true,N/A,
Nano Tips for Interpersonal Communication with Shadé Zahrai,"Welcome to our <i>Nano Tips</i> series, where LinkedIn Learning creators deliver impactful lessons in literally seconds.  In this course, award-winning leadership strategist and peak performance educator for Fortune 500 companies Shadé Zahrai shares tips for improving interpersonal communication skills. Shadé explains the importance of choosing words that foster collaboration, shows how you can transform your communication with positive reinforcement, describes the biggest conversation buzzkill, and more.",Course,2023-12-27 00:28 UTC,N/A,false,N/A,
A Day In The Life of a Data Scientist (2020),"The best way to understand what it's actually like to work as a data scientist is to spend the day with one. In this course, you can follow along with one day in the life of real data scientists working on real projects. Explore exactly what data science work looks like—getting on-the-job insights to help prepare you to tackle the next challenge or choose your next data science role. Discover how working professionals handle time management, starting from the very first hour of the workday, and tackle major tasks, such as exploring the data, mitigating bias, and presenting their findings. Another thing that separates pros from the rest is process and in chapter three, you can see how data scientists build automation, cross-functional collaboration, and other techniques into their workflows. Plus, learn how to choose and use tools, structure and work well in teams, and serve your clients.

<br><br>This course was created by <a href=""http://www.onlymadecraft.com"" target=""_blank"">Madecraft</a>. We are pleased to host this content in our library.<br><br><img src=""https://media.licdn.com/media/AAYAAgCwAAoAAQAAAAAAAHppnBQxgeyWS2CsU3aDDPcMgw.jpg"" height=""25%"" width=""25%"">",Course,2022-10-28 18:48 UTC,N/A,false,N/A,
Marketing Ethics,"Integrity is often a brand's biggest asset. To earn the trust of customers, marketers have to put ethics first. In this course, marketing expert Deirdre Breakenridge explains how to implement and reinforce ethical marketing practices that ensure your employees making decisions that are in the best interests of your company and your customers. First, learn how to analyze the ethics of your marketing organization and define what ethics means to your team and to the public. Then discover how to apply ethical practices to your current workflows and reinforce ethics at every step with training, testing, and metrics. Finally, Deirdre shares specific, real-world case studies that showcase both good and bad examples of ethics in marketing.",Course,N/A,N/A,true,N/A,
Marketing Your Event,"Events are a big business. Over $512 billion is spent annually on events, from trade shows and fundraisers to online webinars, and it can be challenging to attract delegates and attendees in this crowded space. To make your next event a success, you need to plan and promote it far ahead of time. This course offers tips to successfully market your event. Chartered marketer Luan Wise reviews the different types of events, the stages of event marketing, and the resources you need to prepare and make your event more successful. She also reviews different methods of promotion, from traditional advertising and public relations to email, direct mail, and social media.",Course,N/A,N/A,true,N/A,
How to Reduce the Obstacles of Ageism While Job Searching,"<p>Ageism is a common obstacle for job seekers on both sides of the age spectrum. Young and old alike often face crushing odds. And yet, it's even more difficult for older job seekers because of conscious and unconscious biases held by decision-makers in positions of power. While it shouldn't be the exclusive responsibility of older job seekers to overcome ageism while looking for work, there are steps that you can take to minimize the obstacles and make the process less challenging—and more rewarding—along the way.</p><p>Join <i>Yahoo Finance</i>'s Kerry Hannon, a well-known author on aging and retirement, as she sits down to talk with LinkedIn News Editor Andrew Seaman on the podcast <i>Get Hired</i>. Gather tips and insights from Kerry to help you overcome the professional hurdles presented by ageism, including strategies for approaching today’s ever-evolving job market, developing the right mindset, navigating the interview process, and more.</p>",Course,2025-03-07 14:06 UTC,N/A,false,N/A,
The Practicing Photographer,"<p>In <i>The Practicing Photographer</i>, photographer and teacher Ben Long shares a weekly serving of photographic instruction and inspiration. Each installment focuses on a photographic shooting scenario, a piece of gear, or a software technique. Each one concludes with a call to action designed to inspire you to pick up your camera (or your mouse or smartphone) to try the technique for yourself.</p><p>Note: Because this is an ongoing series, viewers will not receive a certificate of completion.</p>",Course,2025-03-17 12:11 UTC,N/A,false,N/A,
Developing Adaptability as a Manager,"The business world is changing faster than ever, with digital transformation and disruption everywhere. Being adaptable is a foundational skill for managers, which enables them to respond to change in positive, resilient ways and seize new opportunities. Join author and professor Dorie Clark, as she introduces strategies for becoming a more adaptable leader. Learn how to monitor for change in order to better prepare for it, hone your skills, and create a more adaptable team that is innovative and responsive to change.",Course,2024-04-17 18:29 UTC,N/A,false,N/A,
