Content Title,Content Description,Content Type,Content Last Watched Date (if viewed),Content Completed At (if completed),Content Saved,Notes taken on videos (if taken),
Managing Your Career: Mid-Career,"Many people experience a mid-career crisis, where you show up, do the work, and take home a paycheck. It is difficult to contemplate a change when you feel boxed into a particular job or you are not being recognized for the work that you are doing. How do you pivot and achieve your career goals? Using the identity framework, Valerie Sutton helps you approach your next move strategically. Designed for the mid-career professional with 10 or more years of experience, this course covers a variety of pathways: moving up in your current career; changing roles, industries, or organizations; or even starting your own business. Change starts now. Dive in and learn how to identify what success means for you and your work, and develop a plan to realize your true career goals.",Course,2024-06-12 20:13 UTC,N/A,false,N/A,
How to Say No without Guilt,"<p>Have you ever said yes to a colleague’s request only to feel regret and resentment later? You might ask, “Why do I do this to myself?!” Science suggests that human beings are naturally inclined to say yes. However, saying no can actually improve your relationships and reputation. In this audio-only course, Dr. Vanessa Patrick shares why we struggle to say no–while providing guilt-free approaches for declining requests.
</p><p>
Dr. Vanessa Patrick is an associate dean at the University of Houston and author of <I>The Power of Saying No: The New Science of How to Say No that Puts you in Charge of your Life</i>.
</p><p>
Learn the three competencies of empowered refusal, and discover how to set rules to protect your priorities–and decipher which requests deserve exceptions. Plus, find out how to make refusing even easier with time and technology buffers
</p>
<p>This course was created by Pete Mockaitis of <a href=""https://awesomeatyourjob.com/"" target=""_blank""><i>How to Be Awesome at Your Job</i></a>. We are pleased to offer this training in our library.</p>
<img src=""https://media.licdn.com/media/AAYAAgCwAAoAAQAAAAAAAIBpAic0FsSvQXaA8NB7qnVcIw.jpg"" alt=""Company logo for How to Be Awesome at Your Job"" width=""20%"" height=""20%"" />",Course,2025-12-11 14:08 UTC,N/A,false,N/A,
Negotiating Your Job Offer and Salary,"In this course, ex-recruiter and current certified career coach, Emily Liou, prepares you to confidently negotiate your job offer. Watch to set yourself up for success from a mindset and strategy level for all phases: before, during, and after the negotiation process. From a recruiter’s perspective, implement clear steps and phrases to negotiate the best offer package. You’ll also find a real demo to showcase how doable negotiating a salary is, even if it’s your first time!",Course,2025-09-19 13:37 UTC,N/A,false,N/A,
Generative AI Tools for Productivity and Research,"Artificial intelligence is growing rapidly, affecting nearly every industry, and it’s not going anywhere. If you’re feeling overwhelmed by the onslaught of AI tools or just feeling out of the loop with the speedy changes in the AI landscape, check out this course with instructor Wuraola Oyewusi. Wuraola explores a wide range of generative AI tools from text to image, language generation with chatbots (Google Gemini, Microsoft Copilot), research (Elicit AI, Litmaps, SciSpace). She shows you how to write, visualize, extract, parse, search, and distill scientific and academic research content. Learn about getting set up, prompting, finding the right tool, and more, and discover how you can use generative AI tools to improve research productivity.",Course,2025-08-29 14:33 UTC,N/A,false,N/A,
Nano Tips on How to Apologize Authentically with Arti Halai,"<p>Welcome to our <i>Nano Tips</i> series, where LinkedIn Learning creators deliver impactful lessons in literally seconds. In this course, Arti Halai guides you through the steps of reflection and thought necessary to share an authentic apology in both personal and professional settings.</p><p>
 
This course was created by Arti Halai and CRFT Productions. We are pleased to host this training in our library.
 </p>",Course,2025-12-04 00:23 UTC,2025-12-04 00:23 UTC,false,N/A,
Understanding Gen-Z Communication Styles for Managers,"In a dynamic shift towards understanding the next generation of workplace talent, Dr. Carol Walsh, a seasoned leadership coach, offers a deep dive into the world of Gen Z. This course unravels the intricacies of communicating, leading, and engaging with Gen Z employees. Dr. Walsh explores the generational context that shapes Gen Z's perspectives, how to leverage technology for effective communication, and how to develop strategies for creating an inclusive, feedback-rich culture.",Course,2025-08-29 01:04 UTC,N/A,false,N/A,
How to Collaborate with Your Colleagues to Build Psychological Safety Together,"<p>In today's dynamic work environments, fostering psychological safety is not just a leadership responsibility but a crucial skill for everyone. Erin Shrimpton, a Chartered Organizational Psychologist with expertise in successful culture change, offers a treasure trove of knowledge and actionable insights for building inclusive, learning-oriented, and creatively rich workplaces for everyone. Whether you're a team member, a leader, or an individual contributor, you'll learn five practical strategies to foster psychological safety, driving innovation and inclusivity among your team and wider organization. </p>

<p>For added impact, try taking this course together with your team, implementing a new strategy each month to maximize learning and impact. Everyone can benefit from the principle that positive change happens not because someone does everything, but because everyone does something.</p>

<p>This course was created by CRFT Productions. We are pleased to host this training in our library.</p>",Course,2024-04-16 02:13 UTC,N/A,false,N/A,
Adobe Express Essential Training,"Whether you’re a creative pro, marketer, presenter, or social media manager, Adobe Express can help you deliver consistently great-looking content in a flash with ease. In this course, join instructor Claudia Vergine as she explores the latest version of Adobe Express. Learn how to perform quick, useful actions, edit a template, create a new document, and add compelling animations that you can customize along the way. By the end of this course, you’ll be equipped with skills you need to work with multiple documents at the same time and leverage the power of Adobe Express’ built-in AI capabilities.",Course,2025-05-21 22:12 UTC,N/A,false,N/A,
CONTENT METADATA NO LONGER EXISTS - urn:li:lyndaCourse:2483131,CONTENT METADATA NO LONGER EXISTS - urn:li:lyndaCourse:2483131,Course,2023-06-12 18:23 UTC,N/A,false,N/A,
"Japanese, Part 3: Improving Fluency, Expression, and Writing","<p>In this course, Yuki Sasaki Caldwell—an experienced instructor of Japanese Language in the Department of Comparative Literature and Intercultural Studies at the University of Georgia (UGA)—shows you some additional ways to speak about the past by using the past-tense forms of i-adjectives, and the aizuchi words that will help your conversation move along more smoothly. You’ll also learn about sushi, from the Edo period up to the present day—and why no one could have eaten the sushi of old with chopsticks. </p>

<p>This course was created by The Great Courses. We are pleased to host this training in our library.</p>",Course,2025-07-28 14:01 UTC,N/A,false,N/A,
Strategic Thinking (2017),"Strategic thinking is the ability to think on a big and small scale, long and short term, and into the past and the present. While strategic thinking is a valuable skill for everyone in an organization, it becomes increasingly essential as you ascend the ladder. In fact, you may have a difficult time being promoted or succeeding as a leader without it. Yet, no one formally teaches strategic thinking—so it's critical to take the initiative and learn how to do it yourself. This course teaches managers and leaders how to use strategic thinking to guide the direction of their teams and come up with solutions to key business problems. Career and personal branding expert Dorie Clark shows you how to carve out time to think about strategy, gather data, learn from the past, create a vision for the future, and implement strategic thinking within your team.",Course,2019-07-21 09:56 UTC,N/A,false,N/A,
Learning Data Analytics: 1 Foundations,"<p>Are you interested in pursuing a career in data analytics? In this course, instructor Robin Hunt brings you into the mind of an analyst. She defines and explains foundational concepts, such as how to think about data, how to work with others in different roles to get the data you need, and the tools you need to work with data, such as Excel and Microsoft Access. She introduces you to SQL queries, PowerBI, and more. Robin goes into syntax and explains how to interpret the data you see, find the data you need, and clean the data for effective data work. She explains data governance and how to ask the right questions of different departments to gather the data you need. Robin shows how to work with data, including how to import data, work with flat files such as CSVs, and create datasets for others. Robin goes into what cleaning and modeling mean, as well as how to use Power Query in Excel. She has also added challenge/solution sets in each chapter to help you evaluate your skills. </p><p>This course is part of a <a href=""https://www.linkedin.com/learning/paths/career-essentials-in-data-analysis-by-microsoft-and-linkedin"">Professional Certificate</a> from Microsoft.</p>",Course,2022-12-21 13:13 UTC,N/A,false,N/A,
Nano Tips for Career Success and Daily Wins with Shadé Zahrai,"<p>Welcome to our <i>Nano Tips</i> series, where LinkedIn Learning creators deliver impactful lessons in literally seconds. In this installment, explore strategies for career success and daily wins with award-winning leadership strategist and peak performance specialist Shadé Zahrai. Learn how to identify career growth areas, address burnout, track achievements, celebrate effort, balance skills with opportunities, and develop daily habits. By the end of this course, you’ll be prepared to manage emotionally charged situations, disrupt procrastination, and improve mental clarity and well-being.</p><p>This course was created by Shadé Zahrai. We are pleased to host this training in our library.</p>",Course,2025-09-01 12:02 UTC,N/A,false,N/A,
The Six Morning Habits of High Performers,"Learn the six habits of the most successful people in history. Hal Elrod describes how they changed his life—and how they can change yours, too—in this course adapted from the podcast <i>How to Be Awesome at Your Job</i>. Elrod is one of the highest rated keynote speakers in America, creator of one of the fastest growing and most engaged online communities in existence, and author of one of the bestselling books in the world, <i>The Miracle Morning</i>. Here he describes approaches for silence that generate new ideas, explains how NOT to do affirmations, and reveals the impact of tiny amounts of exercise. Plus, learn how to do simple practices, like reading and scribing, to introspect and become a better version of yourself.<br><br>This course was created by Pete Mockaitis of <a href=""https://awesomeatyourjob.com/"" target=""_blank""><i>How to Be Awesome at Your Job</i></a>. We are pleased to offer this training in our library.<br><br><img src=""https://media.licdn.com/media/AAYAAgCwAAoAAQAAAAAAAIBpAic0FsSvQXaA8NB7qnVcIw.jpg"" alt=""Company logo for How to Be Awesome at Your Job"" width=""20%"" height=""20%""/>",Course,2022-11-22 16:38 UTC,N/A,false,N/A,
"The Persuasion Code, Part 3: The Neuroscience of Closing Sales","In the end, your success depends on your capacity to close. While many sales methodologies present various closing techniques, they fail to recognize that this delicate phase of your sales journey is about managing your prospects’ fear of regret. In this course, neuromarketing expert Patrick Renvoise will demonstrate the importance of understanding the Primal Brain. This brain, famously called System 1 by Daniel Kahneman—2002 Nobel Prize winner and author of Thinking, Fast and Slow—drives fear, and it becomes very active during the fearful last moment when a decision needs to be made. Using a unique three-step process, learn how to better manage your prospect fear of regret. Find out how to answer the objections that may arise at this point of your sales process. Finally, after a brief discussion on the ethics of neuropsychology, Patrick shows you that preparation and practice are key to get your prospects to say yes.",Course,2023-06-15 21:59 UTC,N/A,false,N/A,
Generative AI for Product Managers,"<p>How can generative AI be used ethically to enhance and extend a product manager's role across the product lifecycle? In this course, Meta product leader Dr. Marily Nika shares key considerations for using cutting-edge tools from generative AI such as ChatGPT to streamline and manage workflows more effectively in product management.</p><p>Learn how to leverage AI to help generate new product ideas, validate backlog requests, draft and implement user segmentation and research plans, and create prototypes for product features and components to define a minimum viable product (MVP). Along the way, Marily offers insights on navigating strategic pivots and redefinitions as well as product testing frameworks, marketing content plans, and supplemental product releases.</p>",Course,2025-10-05 07:30 UTC,N/A,false,N/A,
Logo Design: Creating Brand Extensions,"Brand extensions for logo design refer to the use of an existing brand’s logo and visual identity to launch new products or services in a different category. This can help to leverage the brand’s existing equity and reputation to introduce new offerings to the market. For example, a company known for its athletic wear may use its logo and visual identity to launch a line of sports equipment or nutritional supplements. In this course, designer and illustrator Von Glitschka shows you how to create a cohesive brand experience for consumers and increase the brand’s overall visibility and recognition. In addition to guiding you through the process, Von also highlights specifics like setting up final deliverables and a brand style guide.",Course,2025-11-11 19:57 UTC,N/A,false,N/A,
Chat with Your Data Using ChatGPT,"Elevate your expertise in AI-driven data analysis and customer interaction and find out how to integrate conversational AI into data interaction with ChatGPT and LangChain. In this hands-on course, distinguished tech leader and innovator Kesha Williams guides you through building a ChatGPT-powered chatbot using LangChain, focusing on key topics like prompt engineering, vector databases, data retrieval, and question answering. By the end of the course, you will understand how to develop complex LLM applications, handle vector databases, and create AI solutions that intelligently interact with and extract insights from diverse data sources.",Course,2025-07-11 17:58 UTC,N/A,false,N/A,
Creating Your First Marketing Videos on LinkedIn Nano Tips with Shay Rowbottom,"Welcome to our <i>Nano Tips</i> series, where LinkedIn Learning creators deliver impactful lessons in literally seconds. In this installment, Shay Rowbottom teaches expert tips on creating and sharing your videos on LinkedIn to market your business. Shay explains the factors to consider when making your first video, like topics to cover, video quality concerns, and video lengths. She then explains how to use your videos as a marketing tool to get you noticed.",Course,2025-08-22 19:47 UTC,N/A,false,N/A,
Nano Tips for Strategic Thinking with Lisa Bodell,"Welcome to our <i>Nano Tips</i> series, where LinkedIn Learning creators deliver impactful lessons in seconds. In this installment, Lisa Bodell offers tips on how to engage in consistent strategic planning techniques to hone in on an effective strategy, analyze competitors, and simplify decision-making.",Course,2025-04-11 09:29 UTC,N/A,false,N/A,
Demystifying Agentic AI with ChatGPT: Elevate Your Skills and Unlock New Potential,"Explore the power of agentic AI in this course with instructor Jules White. Jules simplifies the concept of agentic AI, helping you understand how to interact with and harness these intelligent agents effectively. Imagine agents autonomously scheduling meetings, drafting tailored reports, or even managing customer inquiries—all while you focus on strategic tasks. Learn how these agents work and gain the fundamental knowledge to start building AI in a new way, revolutionizing your approach to productivity and innovation.",Course,2025-08-09 13:19 UTC,N/A,false,N/A,
"Synthetic Data as the Future of AI Privacy, Explainability, and Fairness: An Introduction for Data Scientists and Data Executives","<p>The European Commission’s JRC sees synthetic data as “the key enabler for artificial intelligence,” and analyst firm Gartner predicts that, by 2024, 60% of all AI training data will be synthetic—yet many data and AI professionals are not yet familiar with this privacy-enhancing technology. In this course, synthetic data and privacy expert Alexandra Ebert teaches you the fundamentals of AI-generated synthetic data. Learn how synthetic data can help you stay in compliance with privacy laws. Find out what AI-generated synthetic data is and go over its benefits and limitations. Explore how synthetic data can support your organization’s strategic objectives. Dive into ways to assess synthetic data’s quality and discover best practices for getting started with synthetic data and introducing it within your organization. Plus, learn about different ways synthetic data is used, particularly in the context of Responsible AI or Ethical AI.</p>",Course,2025-06-06 17:33 UTC,N/A,false,N/A,
"Italian, Part 4: Using and Expanding Your Skills","<p>Explore the beauty and diversity of Italy’s history, culture, and cuisine as you learn how to handle real-life conversations in Italian. Tuscany is perhaps Italy’s most celebrated and popular region, and the cradle of the Renaissance. This course—the fourth in a four-part series from The Great Courses covers Tuscany's breathtaking medieval cities, beloved food specialties, and iconic artists and writers. See how the <i>passato prossimo</i> tense is used with the auxiliary verb ""essere."" Study expressions of time, and practice your skills in describing the life of Florentine painter Sandro Botticelli.</p>

<p><b>About the instructor</b><br><br>
Kristina Olson is an associate professor of Italian and the Italian program coordinator at George Mason University, where she has taught Italian language, literature, and cinema since 2005. She earned her PhD in Italian from Columbia University. Professor Olson is the author of <i>Courtesy Lost: Dante, Boccaccio, and the Literature of History</i> and several articles on Dante, Boccaccio, and Petrarch. She is the coeditor of <i>Open City: Seven Writers in Postwar Rome</i>; <i>Boccaccio 1313–2013</i>; and the second edition of <i>Approaches to Teaching Dante’s Divine Comedy</i> with the Modern Language Association. Professor Olson is the president of the American Boccaccio Association and was the vice president of the Dante Society of America.</p>",Course,2025-07-31 00:30 UTC,N/A,false,N/A,
Python Data Structures and Algorithms,"Software developers know that efficient underlying architecture is essential to the technologies we use every day. Knowledge of data structures and the algorithms which they support helps developers choose the most suitable solution for a given context, making them better programmers who stand out to their company, clients, or prospective employers. In this course, leveraging the Python programming language, instructor Robin Andrews uses a combo of visual, theoretical, and hands-on programming approaches to explain concepts in a fun and accessible way. Robin explains some of the most important data structures such as stacks, queues, and priority queues, and how these are used by search algorithms such as depth-first search, breadth-first search, and the A-star (A*) algorithm. He shows how to trace the execution of algorithms. Along the way, he provides challenges that allow you to test your new skills.",Course,2022-07-21 19:19 UTC,N/A,false,N/A,
Nano Tips for Understanding AI's Impact to Business with Marco Andre,"Welcome to our <i>Nano Tips</i> series, where LinkedIn Learning creators deliver impactful lessons in literally seconds. In this course, Marco Andre offers tips on understanding the impact of artificial intelligence in business, and how leaders can  become more productive and creative at work by thinking about AI first.",Course,2025-02-04 18:20 UTC,N/A,false,N/A,
Java Object-Oriented Programming,"<p>Are you familiar with Java but want to get the most out of your Java programs? In this course, Kathryn Hodge teaches the basics of object-oriented programming in Java, so you can write code that’s secure, scalable, and easier to troubleshoot. Kathryn begins by showing how object-oriented principles are embedded into the Java language from the first code file you create. She looks at how classes, instances, and constructors embody the idea of representing real-life objects in code. Kathryn not only shows how to apply object-oriented principles in your own programs, but also explains how Java leverages these principles behind the scenes. While many resources about object-oriented programming focus on abstract examples, the goal of this course is to get away from the abstract and focus more on practical examples of these principles in Java. Along with deep dives into the source code, this course also provides several challenges and solutions to help you apply what you’ve learned.</p><p>This course is part of a <a href=""https://www.linkedin.com/learning/paths/java-foundations-professional-certificate-by-jetbrains"" target=""_blank"">Professional Certificate</a> from JetBrains.</p>",Course,2022-08-19 15:02 UTC,N/A,false,N/A,
Nano Tips for Managing Gen Z with Watchen Nyanue,"<p>Welcome to our <i>Nano Tips</i> series, where LinkedIn Learning creators deliver impactful lessons in literally seconds. In this installment, join Watchen Nyanue Hampton—thought leader, career architect, and the founder of I Choose The Ladder—as she shares practical, easy-to-use strategies for successfully engaging and managing Gen Z employees.</p><p>Learn how to identify and implement authentic diversity practices, communicate the purpose behind work tasks and projects, tailor career development paths, adjust your communication style, leverage microlearning for professional development, and recognize and reward your employees. Along the way, Watchen shows you how to think globally and act locally, as well as create opportunities for mentoring. By the end of this course, you’ll also be prepared to enhance transparency, build your credibility, and prioritize getting to know your employees.</p>",Course,2025-02-21 10:31 UTC,N/A,false,N/A,
CONTENT METADATA NO LONGER EXISTS - urn:li:lyndaCourse:728380,CONTENT METADATA NO LONGER EXISTS - urn:li:lyndaCourse:728380,Course,2019-07-21 10:57 UTC,N/A,false,N/A,
Navigating Personal Trauma and Triggers at Work,"In this course, trauma expert Dr. Mariel Buqué explores how to navigate past traumas and triggers that may affect us while we are at work. She will guide learners through identifying ways traumas can affect the ways we respond to situations and how we can navigate situations that trigger a stress response, including ways to proactively mitigate triggers, ways to calm our nervous systems, build metacognition, increase cognitive flexibility, reframe challenging situations, boost our resilience, and manage lingering emotions. She also discusses ways to know how and when to disclose past traumas at work and how to become a more trauma-informed colleague.",Course,2025-02-27 02:27 UTC,N/A,false,N/A,
CONTENT METADATA NO LONGER EXISTS - urn:li:lyndaCourse:728382,CONTENT METADATA NO LONGER EXISTS - urn:li:lyndaCourse:728382,Course,2021-05-15 11:41 UTC,N/A,false,N/A,
CONTENT METADATA NO LONGER EXISTS - urn:li:lyndaCourse:4598000,CONTENT METADATA NO LONGER EXISTS - urn:li:lyndaCourse:4598000,Course,2024-06-22 02:41 UTC,N/A,false,N/A,
Pitching Yourself for Opportunity,"<p>Every conversation presents an opportunity to make a great impression. In this course, Jodi Glickman, CEO and Founder of GreatOnTheJob.com, guides you through how to craft a compelling pitch with thought and intention so you can be persuasive, memorable, and able to reach your goals. Jodi shares the fundamental framework of leading with your destination, crafting your backstory, and then connecting the dots.  She covers pitch basics (it’s a dialogue, not a monologue!), cautions against mistakes to avoid, and shares why no two pitches are ever the same. Plus, Jodi offers behind-the-scenes coaching on real-life examples of how to try out, practice, and improve your pitch.</p>",Course,2025-08-23 15:10 UTC,N/A,false,N/A,
